{
  "schema": "acef.assurance-capsule.v1",
  "runId": "REHEARSAL-v325",
  "fullFlowContract": "four-actor-v3",
  "runtimeContract": "capsule-supervisor-v1",
  "story": "s1-resolver-fail-closed",
  "role": "code-review",
  "actorInstanceId": "acef_s1_resolver_fail_closed_code_review",
  "reviewCycle": 0,
  "baseCommit": "8d65305ccd5d8793bd5bb0b089bdcb7088081295",
  "inputCommit": "174fadf97767c946c5a46b4b3495cf722e260738",
  "inputTree": "ad7c22aeaea2cdff9a5d08a2cacb4aa39f1af482",
  "scopePaths": [
    "packages/platform/authz/src/Http/RouteRequirementResolver.php",
    "tests/Unit/Platform/Authz/RouteRequirementResolverTest.php"
  ],
  "acceptanceIds": [
    "s1-resolver-fail-closed-ac1",
    "s1-resolver-fail-closed-ac2",
    "s1-resolver-fail-closed-ac3"
  ],
  "currentContext": {
    "path": "docs/ai/ACEF_CURRENT_CONTEXT.md",
    "sha256": "e6bd3848eadccc28755795d955f1b8271c8c19e06f59493e702cc5d495999bf8",
    "bytes": 386,
    "content": "# ACEF Current Context\n\n- Run: `REHEARSAL-v325`\n- Contract: `four-actor-v3`\n- Runtime: `capsule-supervisor-v1`\n- Assurance: `guarded`\n- Scope unit: `story`\n- Active story: `s1-resolver-fail-closed`\n- Active phase: `code-review`\n- Next allowed step: follow the typed supervisor action\n- Stop rule: refuse writes outside typed scope; stop fail-closed when state and supervisor disagree.\n\n"
  },
  "diff": {
    "path": "git-diff:8d65305ccd5d8793bd5bb0b089bdcb7088081295..174fadf97767c946c5a46b4b3495cf722e260738",
    "sha256": "05f102952aa222a7c324d7b13644df7c63c1b2a3d570d42de0caeb6ce57937ef",
    "bytes": 11018,
    "content": "diff --git a/packages/platform/authz/src/Http/RouteRequirementResolver.php b/packages/platform/authz/src/Http/RouteRequirementResolver.php\nindex 75156bc6..f9462c1b 100644\n--- a/packages/platform/authz/src/Http/RouteRequirementResolver.php\n+++ b/packages/platform/authz/src/Http/RouteRequirementResolver.php\n@@ -1,120 +1,130 @@\n <?php\n \n declare(strict_types=1);\n \n namespace Platform\\Authz\\Http;\n \n+use InvalidArgumentException;\n+\n class RouteRequirementResolver\n {\n     /** @var array<string, string> Map of special permission names to user method names */\n     private array $specialPermissions;\n \n     /**\n      * @param array<string, string> $specialPermissions Map of special permission name => user method name\n      */\n     public function __construct(array $specialPermissions = [])\n     {\n         $this->specialPermissions = $specialPermissions;\n     }\n \n     /**\n      * Resolve the requirement for a given route name.\n      *\n      * Reads from config('route_permissions.routes') and parses the permission\n      * string into a structured RouteRequirement.\n      *\n      * @return RouteRequirement|null Null if route not found in config\n      */\n     public function resolve(string $routeName): ?RouteRequirement\n     {\n         $routes = config('route_permissions.routes', []);\n \n         if (!array_key_exists($routeName, $routes)) {\n             return null; // Missing mapping is handled as a fail-closed error by the middleware.\n         }\n \n         $permissionString = $routes[$routeName];\n \n         if ($permissionString === null) {\n             return new RouteRequirement(RouteRequirement::TYPE_NONE);\n         }\n \n         return $this->parse($permissionString);\n     }\n \n     /**\n      * Parse a permission string into a RouteRequirement.\n      *\n      * Supports:\n      *   - 'capability.string.scope' → TYPE_SINGLE\n      *   - 'cap1 | cap2' → TYPE_ANY_OF\n      *   - 'cap1 & cap2' → TYPE_ALL_OF (each part may contain | for OR)\n      *   - 'system_admin_access' → TYPE_SPECIAL (if in specialPermissions map)\n      */\n     public function parse(string $permissionString): RouteRequirement\n     {\n         $permissionString = trim($permissionString);\n \n         if ($permissionString === '__public__') {\n             return new RouteRequirement(RouteRequirement::TYPE_PUBLIC);\n         }\n \n         // Check if it's a special permission\n         if (isset($this->specialPermissions[$permissionString])) {\n             return new RouteRequirement(\n                 type: RouteRequirement::TYPE_SPECIAL,\n                 specialMethod: $this->specialPermissions[$permissionString],\n             );\n         }\n \n         // Split by '&' for AND clauses\n         $andClauses = array_map('trim', explode('&', $permissionString));\n         $andClauses = array_filter($andClauses, fn(string $c) => $c !== '');\n \n         if (count($andClauses) === 0) {\n-            return new RouteRequirement(RouteRequirement::TYPE_NONE);\n+            throw new InvalidArgumentException(\n+                'Route permission expression must contain at least one capability.',\n+            );\n         }\n \n         if (count($andClauses) === 1) {\n             // Single clause — might contain | for OR\n             return $this->parseClause($andClauses[0]);\n         }\n \n         // Multiple AND clauses — each is a sub-requirement\n         $subRequirements = array_map(fn(string $clause) => $this->parseClause($clause), $andClauses);\n \n         return new RouteRequirement(\n             type: RouteRequirement::TYPE_ALL_OF,\n             clauses: $subRequirements,\n         );\n     }\n \n     private function parseClause(string $clause): RouteRequirement\n     {\n         $clause = trim($clause);\n \n         // Check if this clause is a special permission\n         if (isset($this->specialPermissions[$clause])) {\n             return new RouteRequirement(\n                 type: RouteRequirement::TYPE_SPECIAL,\n                 specialMethod: $this->specialPermissions[$clause],\n             );\n         }\n \n         // Check for OR (|)\n         $orParts = array_map('trim', explode('|', $clause));\n         $orParts = array_filter($orParts, fn(string $p) => $p !== '');\n \n+        if (count($orParts) === 0) {\n+            throw new InvalidArgumentException(\n+                'Route permission expression must contain at least one capability.',\n+            );\n+        }\n+\n         if (count($orParts) === 1) {\n             return new RouteRequirement(\n                 type: RouteRequirement::TYPE_SINGLE,\n                 capabilities: [$orParts[0]],\n             );\n         }\n \n         return new RouteRequirement(\n             type: RouteRequirement::TYPE_ANY_OF,\n             capabilities: $orParts,\n         );\n     }\n }\ndiff --git a/tests/Unit/Platform/Authz/RouteRequirementResolverTest.php b/tests/Unit/Platform/Authz/RouteRequirementResolverTest.php\nindex cc6b82f5..b87a72d7 100644\n--- a/tests/Unit/Platform/Authz/RouteRequirementResolverTest.php\n+++ b/tests/Unit/Platform/Authz/RouteRequirementResolverTest.php\n@@ -1,44 +1,45 @@\n <?php\n \n namespace Tests\\Unit\\Platform\\Authz;\n \n+use InvalidArgumentException;\n use Tests\\TestCase;\n use Platform\\Authz\\Http\\RouteRequirement;\n use Platform\\Authz\\Http\\RouteRequirementResolver;\n use PHPUnit\\Framework\\Attributes\\Test;\n \n class RouteRequirementResolverTest extends TestCase\n {\n     private RouteRequirementResolver $resolver;\n \n     protected function setUp(): void\n     {\n         parent::setUp();\n \n         // Initialize resolver with special permissions map\n         $this->resolver = new RouteRequirementResolver([\n             'system_admin_access' => 'shouldBypassTeamScope',\n         ]);\n     }\n \n     #[Test]\n     public function resolve_returns_null_for_unknown_route(): void\n     {\n         config(['route_permissions.routes' => [\n             'invoices.index' => 'invoices.view.team',\n         ]]);\n \n         $result = $this->resolver->resolve('unknown.route.name');\n \n         $this->assertNull($result);\n     }\n \n     #[Test]\n     public function resolve_returns_none_for_null_permission(): void\n     {\n         config(['route_permissions.routes' => [\n             'public.route' => null,\n         ]]);\n \n         $result = $this->resolver->resolve('public.route');\n \n@@ -129,108 +130,108 @@ public function resolve_handles_special_permission(): void\n \n         $this->assertNotNull($result);\n         $this->assertSame(RouteRequirement::TYPE_SPECIAL, $result->type);\n         $this->assertSame('shouldBypassTeamScope', $result->specialMethod);\n     }\n \n     #[Test]\n     public function resolve_handles_special_in_and_clause(): void\n     {\n         config(['route_permissions.routes' => [\n             'admin.delete' => 'system_admin_access & invoices.delete.team',\n         ]]);\n \n         $result = $this->resolver->resolve('admin.delete');\n \n         $this->assertNotNull($result);\n         $this->assertSame(RouteRequirement::TYPE_ALL_OF, $result->type);\n         $this->assertCount(2, $result->clauses);\n \n         // First clause should be SPECIAL\n         $this->assertSame(RouteRequirement::TYPE_SPECIAL, $result->clauses[0]->type);\n         $this->assertSame('shouldBypassTeamScope', $result->clauses[0]->specialMethod);\n \n         // Second clause should be SINGLE\n         $this->assertSame(RouteRequirement::TYPE_SINGLE, $result->clauses[1]->type);\n         $this->assertSame(['invoices.delete.team'], $result->clauses[1]->capabilities);\n     }\n \n     #[Test]\n     public function parse_trims_whitespace(): void\n     {\n         $result = $this->resolver->parse('  invoices.view.team  |  invoices.view.own  ');\n \n         $this->assertSame(RouteRequirement::TYPE_ANY_OF, $result->type);\n         $this->assertSame(['invoices.view.team', 'invoices.view.own'], $result->capabilities);\n     }\n \n     #[Test]\n     public function parse_empty_string_returns_none(): void\n     {\n-        $result = $this->resolver->parse('');\n+        $this->expectException(InvalidArgumentException::class);\n+        $this->expectExceptionMessage('Route permission expression must contain at least one capability.');\n \n-        $this->assertSame(RouteRequirement::TYPE_NONE, $result->type);\n